{
  "artifactVersion": "1.0.0-draft",
  "publicationStatus": "unpublished",
  "contractVersion": "1.0.0",
  "catalogVersion": "catalog-unpublished-0.1.0",
  "nutritionDatasetVersion": "nutrition-unpublished-0.1.0",
  "ruleSetVersion": "rules-unpublished-0.1.0",
  "conditions": [],
  "supportedPhotoFoodIds": [],
  "nutrients": [],
  "dataMode": "synthetic",
  "publishedAt": "1970-01-01T00:00:00Z"
}
